sub_clause_number_1,sub_clause_number_1_heading,clause_text
10.4,Surfaces Requiring Reinstatement,"Except as otherwise stated in a Taking-Over Certificate, a certificate for a Section or part of the Works shall not be deemed to certify completion of any ground or other surfaces requiring reinstatement."
11.1,Completion of Outstanding Work and Remedying Defects,"In order that the Works and Contractor's Documents, and each Section, shall be in the condition required by the Contract (fair wear and tear excepted) by the expiry date of the relevant Defects Notification Period or as soon as practicable thereafter, the Contractor shall:
(a) complete any work which is outstanding on the date stated in a Taking-Over Certificate, within such reasonable time as is instructed by the Engineer, and
(b) execute all work required to remedy defects or damage, as may be notified by (or on behalf of) the Employer on or before the expiry date of the Defects Notification Period for the Works or Section (as the case may be).
If a defect appears or damage occurs, the Contractor shall be notified accordingly, by (or on behalf of) the Employer."
11.2,Cost of Remedying Defects,"All work referred to in sub-paragraph (b) of Sub-Clause 11.1 [Completion of Outstanding Work and Remedying Defects] shall be executed at the risk and cost of the Contractor, if and to the extent that the work is attributable to:
(a) the design of the Works, other than a part of the design for which the Employer is responsible (if any),
(b) Plant, Materials or workmanship not being in accordance with the Contract,(c) improper operation or maintenance which was attributable to matters for which the Contractor is responsible (under Sub-Clauses 5.5 to 5.7 or otherwise), or (d) failure by the Contractor to comply with any other obligation.
If and to the extent that such work is attributable to any other cause, the Contractor shall be notified promptly by (or on behalf of) the Employer, and Sub-Clause 13.3 [Variation Procedure] shall apply."
11.3,Extension of Defects Notification Period,"The Employer shall be entitled subject to Sub-Clause 2.5 [Employer's Claims] to an extension of the Defects Notification Period for the Works or a Section if and to the extent that the Works, Section or a major item of Plant (as the case may be, and after taking over) cannot be used for the purposes for which they are intended by reason of a defect or damage. However, a Defects Notification Period shall not be extended by more than two years.
If delivery and/or erection of Plant and/or Materials was suspended under Sub-Clause 8.8 [Suspension of Work] or Sub-Clause 16.1 [Contractor's Entitlement to Suspend Work], the Contractor's obligations under this Clause shall not apply to any defects or damage occurring more than two years after the Defects Notification Period for the Plant and/or Materials would otherwise have expired."
11.4,Failure to Remedy Defects,"If the Contractor fails to remedy any defect or damage within a reasonable time, a date may be fixed by (or on behalf of) the Employer, on or by which the defect or damage is to be remedied. The Contractor shall be given reasonable notice of this date. If the Contractor fails to remedy the defect or damage by this notified date and this remedial work was to be executed at the cost of the Contractor under Sub-Clause 11.2 [Cost of Remedying Defects], the Employer may (at his option):
(a) carry out the work himself or by others, in a reasonable manner and at the Contractor's cost, but the Contractor shall have no responsibility for this work; and the Contractor shall subject to Sub-Clause 2.5 [Employer's Claims] pay to the Employer the costs reasonably incurred by the Employer in remedying the defect or damage;
(b) require the Engineer to agree or determine a reasonable reduction in the Contract Price in accordance with Sub-Clause 3.5 [Determinations]; or
(c) if the defect or damage deprives the Employer of substantially the whole benefit of the Works or any major part of the Works, terminate the Contract as a whole, or in respect of such major part which cannot be put to the intended use.
Without prejudice to any other rights, under the Contract or otherwise, the Employer shall then be entitled to recover all sums paid for the Works or for such part (as the case may be), plus financing costs and the cost of dismantling the same, clearing the Site and returning Plant and Materials to the Contractor."
11.5,Removal of Defective Work,"If the defect or damage cannot be remedied expeditiously on the Site and the Employer gives consent, the Contractor may remove from the Site for the purposes of repair such items of Plant as are defective or damaged. This consent may require the Contractor to increase the amount of the Performance Security by the full replacement cost of these items, or to provide other appropriate security."
11.6,Further Tests,"If the work of remedying of any defect or damage may affect the performance of the Works, the Engineer may require the repetition of any of the tests described in the Contract, including Tests on Completion and/or Tests after Completion. The requirement shall be made by notice within 28 days after the defect or damage is remedied.
These tests shall be carried out in accordance with the terms applicable to the previous tests, except that they shall be carried out at the risk and cost of the Party liable, under Sub-Clause 11.2 [Cost of Remedying Defects], for the cost of the remedial work."
11.7,Right of Access,"Until the Performance Certificate has been issued, the Contractor shall have the right of access to all parts of the Works and to records of the operation and performance of the Works, except as may be inconsistent with the Employer's reasonable security restrictions."
11.8,Contractor to Search,"The Contractor shall, if required by the Engineer, search for the cause of any defect, under the direction of the Engineer. Unless the defect is to be remedied at the cost of the Contractor under Sub-Clause 11.2 [Cost of Remedying Defects], the Cost of the search plus reasonable profit shall be agreed or determined by the Engineer in accordance with Sub-Clause 3.5 [Determinations] and shall be included in the Contract Price."
11.9,Performance Certificate,"Performance of the Contractor's obligations shall not be considered to have been completed until the Engineer has issued the Performance Certificate to the Contractor, stating the date on which the Contractor completed his obligations under the Contract.
The Engineer shall issue the Performance Certificate within 28 days after the latest of the expiry dates of the Defects Notification Periods, or as soon thereafter as the Contractor has supplied all the Contractor's Documents and completed and tested all the Works, including remedying any defects. A copy of the Performance Certificate shall be issued to the Employer.
Only the Performance Certificate shall be deemed to constitute acceptance of the Works."
11.10,Unfulfilled Obligations,"After the Performance Certificate has been issued, each Party shall remain liable for the fulfilment of any obligation which remains unperformed at that time. For the purposes of determining the nature and extent of unperformed obligations, the Contract shall be deemed to remain in force."
11.11,Clearance of Site,"Upon receiving the Performance Certificate, the Contractor shall remove any remaining Contractor's Equipment, surplus material, wreckage, rubbish and Temporary Works from the Site.
If all these items have not been removed within 28 days after the Employer receives a copy of the Performance Certificate, the Employer may sell or otherwise dispose of any remaining items. The Employer shall be entitled to be paid the costs incurred in connection with, or attributable to, such sale or disposal and restoring the Site.
Any balance of the moneys from the sale shall be paid to the Contractor. If these moneys are less than the Employer's costs, the Contractor shall pay the outstanding balance to the Employer."
12.1,Procedure for Tests after Completion,"If Tests after Completion are specified in the Contract, this Clause shall apply. Unless otherwise stated in the Particular Conditions, the Employer shall: 
(a) provide all electricity, equipment, fuel, instruments, labour, materials, and suitably qualified and experienced staff, as are necessary to carry out the Tests after Completion efficiently, and
(b) carry out the Tests after Completion in accordance with the manuals supplied by the Contractor under Sub-Clause 5.7 [Operation and Maintenance Manuals] and such guidance as the Contractor may be required to give during the course of these Tests; and in the presence of such Contractor's Personnel as either Party may reasonably request.
The Tests after Completion shall be carried out as soon as is reasonably practicable after the Works or Section have been taken over by the Employer. The Employer shall give to the Contractor 21 days' notice of the date after which the Tests after Completion will be carried out. Unless otherwise agreed, these Tests shall be carried out within 14 days after this date, on the day or days determined by the Employer.
If the Contractor does not attend at the time and place agreed, the Employer may proceed with the Tests after Completion, which shall be deemed to have been made in the Contractor's presence, and the Contractor shall accept the readings as accurate.
The results of the Tests after Completion shall be compiled and evaluated by both Parties. Appropriate account shall be taken of the effect of the Employer's prior use of the Works."
12.2,Delayed Tests,"If the Contractor incurs Cost as a result of any unreasonable delay by the Employer to the Tests after Completion, the Contractor shall (i) give notice to the Engineer and (ii) be entitled subject to Sub-Clause 20.1 [Contractor's Claims] to payment of any such Cost plus reasonable profit, which shall be included in the Contract Price. 
After receiving this notice, the Engineer shall proceed in accordance with Sub-Clause 3.5 [Determinations] to agree or determine this Cost and profit.
If, for reasons not attributable to the Contractor, a Test after Completion on the Works or any Section cannot be completed during the Defects Notification Period (or any other period agreed upon by both Parties), then the Works or Section shall be deemed to have passed this Test after Completion."
12.3,Retesting,"If the Works, or a Section, fail to pass the Tests after Completion:
(a) sub-paragraph (b) of Sub-Clause 11.1 [Completion of Outstanding Work and Remedying Defects] shall apply, and
(b) either Party may then require the failed Tests, and the Tests after Completion on any related work, to be repeated under the same terms and conditions.
If and to the extent that this failure and retesting are attributable to any of the matters listed in sub-paragraphs (a) to (d) of Sub-Clause 11.2 [Cost of Remedying Defects] and cause the Employer to incur additional costs, the Contractor shall subject to Sub- Clause 2.5 [Employer's Claims] pay these costs to the Employer."
12.4,Failure to Pass Tests after Completion,"If the following conditions apply, namely:
(a) the Works, or a Section, fail to pass any or all of the Tests after Completion,
(b) the relevant sum payable as non-performance damages for this failure is stated (or its method of calculation is defined) in the Contract, and
(c) the Contractor pays this relevant sum to the Employer during the Defects Notification Period,
then the Works or Section shall be deemed to have passed these Tests after Completion.
If the Works, or a Section, fail to pass a Test after Completion and the Contractor proposes to make adjustments or modifications to the Works or such Section, the Contractor may be instructed by (or on behalf of) the Employer that right of access to the Works or Section cannot be given until a time that is convenient to the Employer. The Contractor shall then remain liable to carry out the adjustments or modifications and to satisfy this Test, within a reasonable period of receiving notice by (or on behalf of) the Employer of the time that is convenient to the Employer. However, if the Contractor does not receive this notice during the relevant Defects Notification Period, the Contractor shall be relieved of this obligation and the Works or Section (as the case may be) shall be deemed to have passed this Test after Completion.
If the Contractor incurs additional Cost as a result of any unreasonable delay by the Employer in permitting access to the Works or Plant by the Contractor, either to investigate the causes of a failure to pass a Test after Completion or to carry out any adjustments or modifications, the Contractor shall (i) give notice to the Engineer and (ii) be entitled subject to Sub-Clause 20.1 [Contractor's Claims] to payment of any such Cost plus reasonable profit, which shall be included in the Contract Price.
After receiving this notice, the Engineer shall proceed in accordance with Sub-Clause 3.5 [Determinations] to agree or determine this Cost and profit."
13.1,Right to Vary,"Variations may be initiated by the Engineer at any time prior to issuing the Taking-Over Certificate for the Works, either by an instruction or by a request for the Contractor to submit a proposal. A Variation shall not comprise the omission of any work which is to be carried out by others.
The Contractor shall execute and be bound by each Variation, unless the Contractor promptly gives notice to the Engineer stating (with supporting particulars) that (i) the Contractor cannot readily obtain the Goods required for the Variation, (ii) it will reduce the safety or suitability of the Works, or (iii) it will have an adverse impact on the achievement of the Schedule of Guarantees. Upon receiving this notice, the Engineer shall cancel, confirm or vary the instruction."
13.2,Value Engineering,"The Contractor may, at any time, submit to the Engineer a written proposal which (in the Contractor's opinion) will, if adopted, (i) accelerate completion, (ii) reduce the cost to the Employer of executing, maintaining or operating the Works, (iii) improve the efficiency or value to the Employer of the completed Works, or (iv) otherwise be of benefit to the Employer.
The proposal shall be prepared at the cost of the Contractor and shall include the items listed in Sub-Clause 13.3 [Variation Procedure]."
13.3,Variation Procedure,"If the Engineer requests a proposal, prior to instructing a Variation, the Contractor shall respond in writing as soon as practicable, either by giving reasons why he cannot comply (if this is the case) or by submitting:
(a) a description of the proposed design and/or work to be performed and a programme for its execution,
(b) the Contractor's proposal for any necessary modifications to the programme according to Sub-Clause 8.3 [Programme] and to the Time for Completion, and (c) the Contractor's proposal for adjustment to the Contract Price.
The Engineer shall, as soon as practicable after receiving such proposal (under Sub-Clause 13.2 [Value Engineering] or otherwise), respond with approval, disapproval or comments. The Contractor shall not delay any work whilst awaiting a response. 
Each instruction to execute a Variation, with any requirements for the recording of Costs, shall be issued by the Engineer to the Contractor, who shall acknowledge receipt.
Upon instructing or approving a Variation, the Engineer shall proceed in accordance with Sub-Clause 3.5 [Determinations] to agree or determine adjustments to the Contract Price and the Schedule of Payments. These adjustments shall include reasonable profit, and shall take account of the Contractor's submissions under Sub-Clause 13.2 [Value Engineering] if applicable."
13.4,Payment in Applicable Currencies,"If the Contract provides for payment of the Contract Price in more than one currency, then whenever an adjustment is agreed, approved or determined as stated above, the amount payable in each of the applicable currencies shall be specified. For this purpose, reference shall be made to the actual or expected currency proportions of the Cost of the varied work, and to the proportions of various currencies specified for payment of the Contract Price."
13.5,Provisional Sums,"Each Provisional Sum shall only be used, in whole or in part, in accordance with the Engineer's instructions, and the Contract Price shall be adjusted accordingly. The total sum paid to the Contractor shall include only such amounts, for the work, supplies or services to which the Provisional Sum relates, as the Engineer shall have instructed. For each Provisional Sum, the Engineer may instruct:
(a) work to be executed (including Plant, Materials or services to be supplied) by the Contractor and valued under Sub-Clause 13.3 [Variation Procedure]; and/or
(b) Plant, Materials or services to be purchased by the Contractor, for which there shall be included in the Contract Price:
(i) the actual amounts paid (or due to be paid) by the Contractor, and
(ii) a sum for overhead charges and profit, calculated as a percentage of these actual amounts by applying the relevant percentage rate (if any) stated in the appropriate Schedule. If there is no such rate, the percentage rate stated in the Appendix to Tender shall be applied.
The Contractor shall, when required by the Engineer, produce quotations, invoices, vouchers and accounts or receipts in substantiation."
13.6,Daywork,"For work of a minor or incidental nature, the Engineer may instruct that a Variation shall be executed on a daywork basis. The work shall then be valued in accordance with the daywork schedule included in the Contract, and the following procedure shall apply. If a daywork schedule is not included in the Contract, this Sub-Clause shall not apply.
Before ordering Goods for the work, the Contractor shall submit quotations to the Engineer. When applying for payment, the Contractor shall submit invoices, vouchers and accounts or receipts for any Goods.
Except for any items for which the daywork schedule specifies that payment is not due, the Contractor shall deliver each day to the Engineer accurate statements in duplicate which shall include the following details of the resources used in executing the previous day's work:
(a) the names, occupations and time of Contractor's Personnel,
(b) the identification, type and time of Contractor's Equipment and Temporary Works, and
(c) the quantities and types of Plant and Materials used. One copy of each statement will, if correct, or when agreed, be signed by the Engineer and returned to the Contractor. The Contractor shall then submit priced statements of these resources to the Engineer, prior to their inclusion in the next Statement under Sub-Clause 14.3 [Application for Interim Payment Certificates]."
13.7,Adjustments for Changes in Legislation,"The Contract Price shall be adjusted to take account of any increase or decrease in Cost resulting from a change in the Laws of the Country (including the introduction of new Laws and the repeal or modification of existing Laws) or in the judicial or official governmental interpretation of such Laws, made after the Base Date, which affect the Contractor in the performance of obligations under the Contract.
If the Contractor suffers (or will suffer) delay and/or incurs (or will incur) additional Cost as a result of these changes in the Laws or in such interpretations, made after the Base Date, the Contractor shall give notice to the Engineer and shall be entitled subject to Sub-Clause 20.1 [Contractor's Claims] to:
(a) an extension of time for any such delay, if completion is or will be delayed, under Sub-Clause 8.4 [Extension of Time for Completion], and
(b) payment of any such Cost, which shall be included in the Contract Price.
After receiving this notice, the Engineer shall proceed in accordance with Sub-Clause 3.5 [Determinations] to agree or determine these matters."
13.8,Adjustments for Changes in Cost,"In this Sub-Clause, ""table of adjustment data"" means the completed table of adjustment data included in the Appendix to Tender. If there is no such table of adjustment data, this Sub-Clause shall not apply.
If this Sub-Clause applies, the amounts payable to the Contractor shall be adjusted for rises or falls in the cost of labour, Goods and other inputs to the Works, by the addition or deduction of the amounts determined by the formulae prescribed in this Sub-Clause. To the extent that full compensation for any rise or fall in Costs is not covered by the provisions of this or other Clauses, the Accepted Contract Amount shall be deemed to have included amounts to cover the contingency of other rises and falls in costs.
The adjustment to be applied to the amount otherwise payable to the Contractor, as valued in accordance with the appropriate Schedule and certified in Payment Certificates, shall be determined from formulae for each of the currencies in which the Contract Price is payable. No adjustment is to be applied to work valued on the basis of Cost or current prices. The formulae shall be of the following general type:
Pn = a + b(Ln/Lo) + c(En/Eo) + d(Mn/Mo) + ......
where:
""Pn"" is the adjustment multiplier to be applied to the estimated contract value in the relevant currency of the work carried out in period ""n"", this period being a month unless otherwise stated in the Appendix to Tender;
""a"" is a fixed coefficient, stated in the relevant table of adjustment data, representing the non-adjustable portion in contractual payments;
""b"", ""c"", ""d"",   are coefficients representing the estimated proportion of each cost element related to the execution of the Works, as stated in the relevant table of adjustment data; such tabulated cost elements may be indicative of resources such as labour, equipment and materials;
""Ln"", ""En"", ""Mn"",   are the current cost indices or reference prices for period ""n"", expressed in the relevant currency of payment, each of which is applicable to the relevant tabulated cost element on the date 49 days prior to the last day of the period (to which the particular Payment Certificate relates); and
""Lo"", ""Eo"", ""Mo"",   are the base cost indices or reference prices, expressed in the relevant currency of payment, each of which is applicable to the relevant tabulated cost element on the Base Date.
The cost indices or reference prices stated in the table of adjustment data shall be used. If their source is in doubt, it shall be determined by the Engineer. For this purpose, reference shall be made to the values of the indices at stated dates (quoted in the fourth and fifth columns respectively of the table) for the purposes of clarification of the source; although these dates (and thus these values) may not correspond to the base cost indices.
In cases where the ""currency of index"" (stated in the table) is not the relevant currency of payment, each index shall be converted into the relevant currency of payment at the selling rate, established by the central bank of the Country, of this relevant currency on the above date for which the index is required to be applicable.
Until such time as each current cost index is available, the Engineer shall determine a provisional index for the issue of Interim Payment Certificates. When a current cost index is available, the adjustment shall be recalculated accordingly.
If the Contractor fails to complete the Works within the Time for Completion, adjustment of prices thereafter shall be made using either (i) each index or price applicable on the date 49 days prior to the expiry of the Time for Completion of the Works, or (ii) the current index or price: whichever is more favourable to the Employer.
The weightings (coefficients) for each of the factors of cost stated in the table(s) of adjustment data shall only be adjusted if they have been rendered unreasonable, unbalanced or inapplicable, as a result of Variations."
14.1,The Contract Price,"Unless otherwise stated in the Particular Conditions:
(a) the Contract Price shall be the lump sum Accepted Contract Amount and be subject to adjustments in accordance with the Contract;
(b) the Contractor shall pay all taxes, duties and fees required to be paid by him under the Contract, and the Contract Price shall not be adjusted for any of these costs, except as stated in Sub-Clause 13.7 [Adjustments for Changes in Legislation];
(c) any quantities which may be set out in a Schedule are estimated quantities and are not to be taken as the actual and correct quantities of the Works which the Contractor is required to execute; and
(d) any quantities or price data which may be set out in a Schedule shall be used for the purposes stated in the Schedule and may be inapplicable for other purposes.
However, if any part of the Works is to be paid according to quantity supplied or work done, the provisions for measurement and evaluation shall be as stated in the Particular Conditions. The Contract Price shall be determined accordingly, subject to adjustments in accordance with the Contract."
