sub_clause_number_1,sub_clause_number_1_heading,clause_text
14.2,Advance Payment,"The Employer shall make an advance payment, as an interest-free loan for mobilisation and design, when the Contractor submits a guarantee in accordance with this Sub-Clause. The total advance payment, the number and timing of instalments (if more than one), and the applicable currencies and proportions, shall be as stated in the Appendix to Tender.
Unless and until the Employer receives this guarantee, or if the total advance payment is not stated in the Appendix to Tender, this Sub-Clause shall not apply.
The Engineer shall issue an Interim Payment Certificate for the first instalment after receiving a Statement (under Sub-Clause 14.3 [Application for Interim Payment Certificates]) and after the Employer receives (i) the Performance Security in accordance with Sub-Clause 4.2 [Performance Security] and (ii) a guarantee in amounts and currencies equal to the advance payment. This guarantee shall be issued by an entity and from within a country (or other jurisdiction) approved by the Employer, and shall be in the form annexed to the Particular Conditions or in another form approved by the Employer.
The Contractor shall ensure that the guarantee is valid and enforceable until the advance payment has been repaid, but its amount may be progressively reduced by the amount repaid by the Contractor as indicated in the Payment Certificates. If the terms of the guarantee specify its expiry date, and the advance payment has not been repaid by the date 28 days prior to the expiry date, the Contractor shall extend the validity of the guarantee until the advance payment has been repaid.
The advance payment shall be repaid through percentage deductions in Payment Certificates. Unless other percentages are stated in the Appendix to Tender:
(a) deductions shall commence in the Payment Certificate in which the total of all certified interim payments (excluding the advance payment and deductions and repayments of retention) exceeds ten per cent (10%) of the Accepted Contract Amount less Provisional Sums; and
(b) deductions shall be made at the amortisation rate of one quarter (25%) of the amount of each Payment Certificate (excluding the advance payment and deductions and repayments of retention) in the currencies and proportions of the advance payment, until such time as the advance payment has been repaid.
If the advance payment has not been repaid prior to the issue of the Taking-Over Certificate for the Works or prior to termination under Clause 15 [Termination by Employer], Clause 16 [Suspension and Termination by Contractor] or Clause 19 [Force Majeure] (as the case may be), the whole of the balance then outstanding shall immediately become due and payable by the Contractor to the Employer."
14.3,Application for Interim Payment Certificates,"The Contractor shall submit a Statement in six copies to the Engineer after the end of the period of payment stated in the Contract (if not stated, after the end of each month), in a form approved by the Engineer, showing in detail the amounts to which the Contractor considers himself to be entitled, together with supporting documents which shall include the relevant report on progress in accordance with Sub-Clause 4.21 [Progress Reports].
The Statement shall include the following items, as applicable, which shall be expressed in the various currencies in which the Contract Price is payable, in the sequence listed:
(a) the estimated contract value of the Works executed and the Contractor's Documents produced up to the end of the month (including Variations but excluding items described in sub-paragraphs (b) to (g) below);
(b) any amounts to be added and deducted for changes in legislation and changes in cost, in accordance with Sub-Clause 13.7 [Adjustments for Changes in Legislation] and Sub-Clause 13.8 [Adjustments for Changes in Cost];
(c) any amount to be deducted for retention, calculated by applying the percentage of retention stated in the Appendix to Tender to the total of the above amounts, until the amount so retained by the Employer reaches the limit of Retention Money (if any) stated in the Appendix to Tender;
(d) any amounts to be added and deducted for the advance payment and repayments in accordance with Sub-Clause 14.2 [Advance Payment];
(e) any amounts to be added and deducted for Plant and Materials in accordance with Sub-Clause 14.5 [Plant and Materials intended for the Works];
(f) any other additions or deductions which may have become due under the Contract or otherwise, including those under Clause 20 [Claims, Disputes and Arbitration]; and
(g) the deduction of amounts certified in all previous Payment Certificates."
14.4,Schedule of Payments,"If the Contract includes a Schedule of Payments specifying the instalments in which the Contract Price will be paid, then, unless otherwise stated in this Schedule:
(a) the instalments quoted in the Schedule of Payments shall be the estimated contract values for the purposes of sub-paragraph (a) of Sub-Clause 14.3 [Application for Interim Payment Certificates];
(b) Sub-Clause 14.5 [Plant and Materials intended for the Works] shall not apply; and
(c) if these instalments are not defined by reference to the actual progress achieved in executing the Works, and if actual progress is found to be less than that on which the Schedule of Payments was based, then the Engineer may proceed in accordance with Sub-Clause 3.5 [Determinations] to agree or determine revised instalments, which shall take account of the extent to which progress is less than that on which the instalments were previously based.
If the Contract does not include a Schedule of Payments, the Contractor shall submit non-binding estimates of the payments which he expects to become due during each quarterly period. The first estimate shall be submitted within 42 days after the Commencement Date. Revised estimates shall be submitted at quarterly intervals, until the Taking-Over Certificate has been issued for the Works."
14.5,Plant and Materials intended for the Works,"If this Sub-Clause applies, Interim Payment Certificates shall include, under subparagraph (e) of Sub-Clause 14.3, (i) an amount for Plant and Materials which have been sent to the Site for incorporation in the Permanent Works, and (ii) a reduction when the contract value of such Plant and Materials is included as part of the Permanent Works under sub-paragraph (a) of Sub-Clause 14.3 [Application for Interim Payment Certificates].
If the lists referred to in sub-paragraphs (b)(i) or (c)(i) below are not included in the Appendix to Tender, this Sub-Clause shall not apply.
The Engineer shall determine and certify each addition if the following conditions are satisfied:
(a) the Contractor has:
(i) kept satisfactory records (including the orders, receipts, Costs and use of Plant and Materials) which are available for inspection, and
(ii) submitted a statement of the Cost of acquiring and delivering the Plant and Materials to the Site, supported by satisfactory evidence; and either:
(b) the relevant Plant and Materials:
(i) are those listed in the Appendix to Tender for payment when shipped, (ii) have been shipped to the Country, en route to the Site, in accordance with the Contract; and
(iii) are described in a clean shipped bill of lading or other evidence of shipment, which has been submitted to the Engineer together with evidence of payment of freight and insurance, any other documents reasonably required, and a bank guarantee in a form and issued by an entity approved by the Employer in amounts and currencies equal to the amount due under this Sub-Clause: this guarantee may be in a similar form to the form referred to in Sub-Clause 14.2 [Advance Payment] and shall be valid until the Plant and Materials are properly stored on Site and protected against loss, damage or deterioration;
or
(c) the relevant Plant and Materials:
(i) are those listed in the Appendix to Tender for payment when delivered to the Site, and
(ii) have been delivered to and are properly stored on the Site, are protected against loss, damage or deterioration, and appear to be in accordance with the Contract.
The additional amount to be certified shall be the equivalent of eighty percent of the Engineer's determination of the cost of the Plant and Materials (including delivery to Site), taking account of the documents mentioned in this Sub-Clause and of the contract value of the Plant and Materials.
The currencies for this additional amount shall be the same as those in which payment will become due when the contract value is included under sub-paragraph (a) of Sub-Clause 14.3 [Application for Interim Payment Certificates]. At that time, the Payment Certificate shall include the applicable reduction which shall be equivalent to, and in the same currencies and proportions as, this additional amount for the relevant Plant and Materials."
14.6,Issue of Interim Payment Certificates,"No amount will be certified or paid until the Employer has received and approved the Performance Security. Thereafter, the Engineer shall, within 28 days after receiving a Statement and supporting documents, issue to the Employer an Interim Payment Certificate which shall state the amount which the Engineer fairly determines to be due, with supporting particulars.
However, prior to issuing the Taking-Over Certificate for the Works, the Engineer shall not be bound to issue an Interim Payment Certificate in an amount which would (after retention and other deductions) be less than the minimum amount of Interim Payment Certificates (if any) stated in the Appendix to Tender. In this event, the Engineer shall give notice to the Contractor accordingly.
An Interim Payment Certificate shall not be withheld for any other reason, although:
(a) if any thing supplied or work done by the Contractor is not in accordance with the Contract, the cost of rectification or replacement may be withheld until rectification or replacement has been completed; and/or
(b) if the Contractor was or is failing to perform any work or obligation in accordance with the Contract, and had been so notified by the Engineer, the value of this work or obligation may be withheld until the work or obligation has been performed.
The Engineer may in any Payment Certificate make any correction or modification that should properly be made to any previous Payment Certificate. A Payment Certificate shall not be deemed to indicate the Engineer's acceptance, approval, consent or satisfaction."
14.7,Payment,"The Employer shall pay to the Contractor:
(a) the first instalment of the advance payment within 42 days after issuing the Letter of Acceptance or within 21 days after receiving the documents in accordance with Sub-Clause 4.2 [Performance Security] and Sub-Clause 14.2 [Advance Payment], whichever is later;
(b) the amount certified in each Interim Payment Certificate within 56 days after the Engineer receives the Statement and supporting documents; and
(c) the amount certified in the Final Payment Certificate within 56 days after the Employer receives this Payment Certificate.
Payment of the amount due in each currency shall be made into the bank account, nominated by the Contractor, in the payment country (for this currency) specified in the Contract."
14.8,Delayed Payment,"If the Contractor does not receive payment in accordance with Sub-Clause 14.7 [Payment], the Contractor shall be entitled to receive financing charges compounded monthly on the amount unpaid during the period of delay. This period shall be deemed to commence on the date for payment specified in Sub-Clause 14.7 [Payment],irrespective (in the case of its sub-paragraph (b)) of the date on which any Interim Payment Certificate is issued.
Unless otherwise stated in the Particular Conditions, these financing charges shall be calculated at the annual rate of three percentage points above the discount rate of the central bank in the country of the currency of payment, and shall be paid in such currency.
The Contractor shall be entitled to this payment without formal notice or certification, and without prejudice to any other right or remedy."
14.9,Payment of Retention Money,"When the Taking-Over Certificate has been issued for the Works, and the Works have passed all specified tests (including the Tests after Completion, if any), the first half of the Retention Money shall be certified by the Engineer for payment to the Contractor. If a Taking-Over Certificate is issued for a Section, the relevant percentage of the first half of the Retention Money shall be certified and paid when the Section passes all tests.
Promptly after the latest of the expiry dates of the Defects Notification Periods, the outstanding balance of the Retention Money shall be certified by the Engineer for payment to the Contractor. If a Taking-Over Certificate was issued for a Section, the relevant percentage of the second half of the Retention Money shall be certified and paid promptly after the expiry date of the Defects Notification Period for the Section.
However, if any work remains to be executed under Clause 11 [Defects Liability] or Clause 12 [Tests after Completion], the Engineer shall be entitled to withhold certification of the estimated cost of this work until it has been executed.
The relevant percentage for each Section shall be the percentage value of the Section as stated in the Appendix to Tender. If the percentage value of a Section is not stated in the Appendix to Tender, no percentage of either half of the Retention Money shall be released under this Sub-Clause in respect of such Section."
14.10,Statement at Completion,"Within 84 days after receiving the Taking-Over Certificate for the Works, the Contractor shall submit to the Engineer six copies of a Statement at completion with supporting documents, in accordance with Sub-Clause 14.3 [Application for Interim Payment Certificates], showing:
(a) the value of all work done in accordance with the Contract up to the date stated in the Taking-Over Certificate for the Works,
(b) any further sums which the Contractor considers to be due, and 
(c) an estimate of any other amounts which the Contractor considers will become due to him under the Contract. Estimated amounts shall be shown separately in this Statement at completion.
The Engineer shall then certify in accordance with Sub-Clause 14.6 [Issue of Interim Payment Certificates]."
14.11,Application for Final Payment Certificate,"Within 56 days after receiving the Performance Certificate, the Contractor shall submit, to the Engineer, six copies of a draft final statement with supporting documents showing in detail in a form approved by the Engineer:
(a) the value of all work done in accordance with the Contract, and
(b) any further sums which the Contractor considers to be due to him under the Contract or otherwise.
If the Engineer disagrees with or cannot verify any part of the draft final statement, the Contractor shall submit such further information as the Engineer may reasonably require and shall make such changes in the draft as may be agreed between them.
The Contractor shall then prepare and submit to the Engineer the final statement as agreed. This agreed statement is referred to in these Conditions as the ""Final Statement"".
However if, following discussions between the Engineer and the Contractor and any changes to the draft final statement which are agreed, it becomes evident that a dispute exists, the Engineer shall deliver to the Employer (with a copy to the Contractor) an Interim Payment Certificate for the agreed parts of the draft final statement. Thereafter, if the dispute is finally resolved under Sub-Clause 20.4 [Obtaining Dispute Adjudication Board's Decision] or Sub-Clause 20.5 [Amicable Settlement], the Contractor shall then prepare and submit to the Employer (with a copy to the Engineer) a Final Statement."
14.12,Discharge,"When submitting the Final Statement, the Contractor shall submit a written discharge which confirms that the total of the Final Statement represents full and final settlement of all moneys due to the Contractor under or in connection with the Contract. This discharge may state that it becomes effective when the Contractor has received the Performance Security and the out-standing balance of this total in which event the discharge will be effective on such date."
14.13,Issue of Final Payment Certificate,"Within 28 days after receiving the Final Statement and written discharge in accordance with Sub-Clause 14.11 [Application for Final Payment Certificate] and Sub-Clause 14.12 [Discharge], the Engineer shall issue, to the Employer, the Final Payment Certificate which shall state:
(a) the amount which is finally due, and
(b) after giving credit to the Employer for all amounts previously paid by the Employer and for all sums to which the Employer is entitled, the balance (if any) due from the Employer to the Contractor or from the Contractor to the Employer, as the case may be.
If the Contractor has not applied for a Final Payment Certificate in accordance with Sub-Clause 14.11 [Application for Final Payment Certificate] and Sub-Clause 14.12 [Discharge], the Engineer shall request the Contractor to do so. If the Contractor fails to submit an application within a period of 28 days, the Engineer shall issue the Final Payment Certificate for such amount as he fairly determines to be due."
14.14,Cessation of Employer s Liability,"The Employer shall not be liable to the Contractor for any matter or thing under or in connection with the Contract or execution of the Works, except to the extent that the Contractor shall have included an amount expressly for it:
(a) in the Final Statement and also
(b) (except for matters or things arising after the issue of the Taking-Over Certificate for the Works) in the Statement at completion described in Sub-Clause 14.10 [Statement at Completion].
However, this Sub-Clause shall not limit the Employer's liability under his indemnification obligations, or the Employer's liability in any case of fraud, deliberate default or reckless misconduct by the Employer."
14.15,Currencies of Payment,"The Contract Price shall be paid in the currency or currencies named in the Appendix to Tender. Unless otherwise stated in the Particular Conditions, if more than one currency is so named, payments shall be made as follows:
(a) if the Accepted Contract Amount was expressed in Local Currency only:
(i) the proportions or amounts of the Local and Foreign Currencies, and the fixed rates of exchange to be used for calculating the payments, shall be as stated in the Appendix to Tender, except as otherwise agreed by both Parties;
(ii) payments and deductions under Sub-Clause 13.5 [Provisional Sums] and Sub-Clause 13.7 [Adjustments for Changes in Legislation] shall be made in the applicable currencies and proportions; and
(iii) other payments and deductions under sub-paragraphs (a) to (d) of Sub-Clause 14.3 [Application for Interim Payment Certificates] shall be made
in the currencies and proportions specified in sub-paragraph (a)(i) above;
(b) payment of the damages specified in the Appendix to Tender shall be made in the currencies and proportions specified in the Appendix to Tender;
(c) other payments to the Employer by the Contractor shall be made in the currency in which the sum was expended by the Employer, or in such currency as may be agreed by both Parties;
(d) if any amount payable by the Contractor to the Employer in a particular currency exceeds the sum payable by the Employer to the Contractor in that currency, the Employer may recover the balance of this amount from the sums otherwise payable to the Contractor in other currencies; and
(e) if no rates of exchange are stated in the Appendix to Tender, they shall be those prevailing on the Base Date and determined by the central bank of the Country."
15.1,Notice to Correct,"If the Contractor fails to carry out any obligation under the Contract, the Engineer may by notice require the Contractor to make good the failure and to remedy it within a specified reasonable time."
15.2,Termination by Employer,"The Employer shall be entitled to terminate the Contract if the Contractor:A
(a) fails to comply with Sub-Clause 4.2 [Performance Security] or with a notice under Sub-Clause 15.1 [Notice to Correct],
(b) abandons the Works or otherwise plainly demonstrates the intention not to continue performance of his obligations under the Contract,
(c) without reasonable excuse fails:
(i) to proceed with the Works in accordance with Clause 8 [Commencement, Delays and Suspension], or
(ii) to comply with a notice issued under Sub-Clause 7.5 [Rejection] or Sub-Clause 7.6 [Remedial Work], within 28 days after receiving it,
(d) subcontracts the whole of the Works or assigns the Contract without the required agreement,
(e) becomes bankrupt or insolvent, goes into liquidation, has a receiving or administration order made against him, compounds with his creditors, or carries on business under a receiver, trustee or manager for the benefit of his creditors, or if any act is done or event occurs which (under applicable Laws) has a similar effect to any of these acts or events, or
(f) gives or offers to give (directly or indirectly) to any person any bribe, gift, gratuity, commission or other thing of value, as an inducement or reward:
(i) for doing or forbearing to do any action in relation to the Contract, or 
(ii) for showing or forbearing to show favour or disfavour to any person in relation to the Contract,
or if any of the Contractor's Personnel, agents or Subcontractors gives or offers to give (directly or indirectly) to any person any such inducement or reward as is described in this sub-paragraph (f). However, lawful inducements and rewards to Contractor's Personnel shall not entitle termination.
In any of these events or circumstances, the Employer may, upon giving 14 days' notice to the Contractor, terminate the Contract and expel the Contractor from the Site. However, in the case of sub-paragraph (e) or (f), the Employer may by notice terminate the Contract immediately.
The Employer's election to terminate the Contract shall not prejudice any other rights of the Employer, under the Contract or otherwise.
The Contractor shall then leave the Site and deliver any required Goods, all Contractor's Documents, and other design documents made by or for him, to the Engineer. However, the Contractor shall use his best efforts to comply immediately with any reasonable instructions included in the notice (i) for the assignment of any subcontract, and (ii) for the protection of life or property or for the safety of the Works.
After termination, the Employer may complete the Works and/or arrange for any other entities to do so. The Employer and these entities may then use any Goods, Contractor's Documents and other design documents made by or on behalf of the Contractor.
The Employer shall then give notice that the Contractor's Equipment and Temporary Works will be released to the Contractor at or near the Site. The Contractor shall promptly arrange their removal, at the risk and cost of the Contractor. However, if by this time the Contractor has failed to make a payment due to the Employer, these items may be sold by the Employer in order to recover this payment. Any balance of the proceeds shall then be paid to the Contractor."
15.3,Valuation at Date of Termination,"As soon as practicable after a notice of termination under Sub-Clause 15.2 [Termination by Employer] has taken effect, the Engineer shall proceed in accordance with Sub-Clause 3.5 [Determinations] to agree or determine the value of the Works, Goods and Contractor's Documents, and any other sums due to the Contractor for  work executed in accordance with the Contract."
15.4,Payment after Termination,"After a notice of termination under Sub-Clause 15.2 [Termination by Employer] has taken effect, the Employer may:
(a) proceed in accordance with Sub-Clause 2.5 [Employer's Claims], (b) withhold further payments to the Contractor until the costs of design, execution, completion and remedying of any defects, damages for delay in completion (if any), and all other costs incurred by the Employer, have been established, and/or
(c) recover from the Contractor any losses and damages incurred by the Employer and any extra costs of completing the Works, after allowing for any sum due to the Contractor under Sub-Clause 15.3 [Valuation at Date of Termination]. After recovering any such losses, damages and extra costs, the Employer shall pay any balance to the Contractor."
15.5,Employer s Entitlement to Termination,"The Employer shall be entitled to terminate the Contract, at any time for the Employer's convenience, by giving notice of such termination to the Contractor. The termination shall take effect 28 days after the later of the dates on which the Contractor receives this notice or the Employer returns the Performance Security.
The Employer shall not terminate the Contract under this Sub-Clause in order to execute the Works himself or to arrange for the Works to be executed by another contractor.
After this termination, the Contractor shall proceed in accordance with Sub-Clause 16.3 [Cessation of Work and Removal of Contractor's Equipment] and shall be paid in accordance with Sub-Clause 19.6 [Optional Termination, Payment and Release]."
